<?xml version="1.0" encoding="UTF-8"?>

<xs:schema xmlns:xs="http://www.w3.org/2001/XMLSchema"
	targetNamespace="http://www.example.org/station_schema" xmlns:tns="http://www.example.org/station_schema"
	elementFormDefault="qualified">

	<xs:element name="station">
		<xs:complexType>
			<xs:sequence>		
				<xs:element name="equipment" type="tns:RentType"  minOccurs="0" maxOccurs="unbounded"/>
				<xs:element name="accesory" type="tns:AdditionType" minOccurs="0"/>		
			</xs:sequence>
			<xs:attribute name="id" type="xs:int" />
		</xs:complexType>
	</xs:element>


	<xs:complexType name="EquipmentType">
		<xs:sequence>
			<xs:element name="title" type="xs:string" />
			<xs:element name="category">
				<xs:simpleType>
					<xs:restriction base="xs:string">
						<xs:pattern value="[A-Z]{2,10}" />
					</xs:restriction>
				</xs:simpleType>
			</xs:element>
		</xs:sequence>
	</xs:complexType>

	<xs:complexType name="RentType">
		<xs:complexContent>
			<xs:extension base="tns:EquipmentType">
				<xs:sequence>
					<xs:element name="price" type="xs:double" />
					<xs:element name="addition" type="tns:AdditionType" minOccurs="0" maxOccurs="unbounded" />
				</xs:sequence>
				<xs:attribute name="id" type="xs:int" />
			</xs:extension>
		</xs:complexContent>
	</xs:complexType>


	<xs:complexType name="AdditionType">
		<xs:complexContent>
			<xs:extension base="tns:EquipmentType">
				<xs:attribute name="amount" type="xs:int" />
			</xs:extension>
		</xs:complexContent>
	</xs:complexType>





</xs:schema>